{
  "permissions": [
    {
      "key": "commercial-use",
      "value": "permitted",
      "citations": [
        { "sentence_id": "s-2", "note": "permission is hereby granted to any person obtaining a copy of this software ... free of charge and under any and all copyright rights ... and any and all patent rights ... to deal in both" },
        { "sentence_id": "s-5", "note": "without restriction, including without limitation the rights to copy, create derivative works of, display, perform, and distribute the Software and make, use, sell, offer for sale, import, export, have made, and have sold" }
      ],
      "external_references": []
    },
    {
      "key": "modification",
      "value": "permitted",
      "citations": [
        { "sentence_id": "s-5", "note": "the rights to copy, create derivative works of, display, perform, and distribute the Software" }
      ],
      "external_references": []
    },
    {
      "key": "distribution",
      "value": "permitted",
      "citations": [
        { "sentence_id": "s-5", "note": "the rights to copy, create derivative works of, display, perform, and distribute the Software ... and to sublicense the foregoing rights on either these or other terms" }
      ],
      "external_references": []
    },
    {
      "key": "private-use",
      "value": "permitted",
      "citations": [
        { "sentence_id": "s-2", "note": "permission is hereby granted ... to deal in" },
        { "sentence_id": "s-5", "note": "without restriction, including without limitation the rights to copy, create derivative works of, display, perform" }
      ],
      "external_references": []
    },
    {
      "key": "patent-use",
      "value": "permitted",
      "citations": [
        { "sentence_id": "s-2", "note": "and any and all patent rights owned or freely licensable by each licensor hereunder covering either (i) the unmodified Software as contributed to or provided by such licensor, or (ii) the Larger Works" },
        { "sentence_id": "s-5", "note": "the rights to ... make, use, sell, offer for sale, import, export, have made, and have sold the Software and the Larger Work(s)" }
      ],
      "external_references": []
    }
  ],
  "conditions": [
    {
      "key": "include-copyright",
      "value": "required",
      "citations": [
        { "sentence_id": "s-7", "note": "The above copyright notice and either this complete permission notice or at a minimum a reference to the UPL must be included in all copies or substantial portions of the Software" }
      ],
      "external_references": []
    },
    {
      "key": "document-changes",
      "value": "silent",
      "citations": [],
      "external_references": []
    },
    {
      "key": "disclose-source",
      "value": "silent",
      "citations": [],
      "external_references": []
    },
    {
      "key": "network-use-disclose",
      "value": "silent",
      "citations": [],
      "external_references": []
    },
    {
      "key": "same-license",
      "value": "silent",
      "citations": [],
      "external_references": []
    },
    {
      "key": "attribution",
      "value": "required",
      "citations": [
        { "sentence_id": "s-7", "note": "The above copyright notice and either this complete permission notice or at a minimum a reference to the UPL must be included in all copies or substantial portions of the Software" }
      ],
      "external_references": []
    }
  ],
  "limitations": [
    {
      "key": "liability",
      "value": "forbidden",
      "citations": [
        { "sentence_id": "s-9", "note": "IN NO EVENT SHALL THE AUTHORS OR COPYRIGHT HOLDERS BE LIABLE FOR ANY CLAIM, DAMAGES OR OTHER LIABILITY" }
      ],
      "external_references": []
    },
    {
      "key": "warranty",
      "value": "forbidden",
      "citations": [
        { "sentence_id": "s-8", "note": "THE SOFTWARE IS PROVIDED AS IS, WITHOUT WARRANTY OF ANY KIND, EXPRESS OR IMPLIED, INCLUDING BUT NOT LIMITED TO THE WARRANTIES OF MERCHANTABILITY, FITNESS FOR A PARTICULAR PURPOSE AND NONINFRINGEMENT" }
      ],
      "external_references": []
    },
    {
      "key": "trademark",
      "value": "silent",
      "citations": [],
      "external_references": []
    }
  ],
  "sources": [
    { "source": "Universal Permissive License 1.0 text", "url": "licenses/upl-1.0/text.html", "role": "primary evidence" }
  ]
}
