{
  "permissions": [
    {
      "key": "commercial-use",
      "value": "permitted",
      "citations": [
        { "sentence_id": "s-32", "note": "2.1 This Licence governs the use, copying, modification, Conveying of Covered Source and Products, and the Making of Products (no non-commercial restriction)" },
        { "sentence_id": "s-50", "note": "Section 4: You may Make Products, and/or Convey them" }
      ],
      "external_references": []
    },
    {
      "key": "modification",
      "value": "permitted",
      "citations": [
        { "sentence_id": "s-39", "note": "3.2 You may modify Covered Source, other than Notices" },
        { "sentence_id": "s-43", "note": "3.3 You may Convey modified Covered Source" }
      ],
      "external_references": []
    },
    {
      "key": "distribution",
      "value": "permitted",
      "citations": [
        { "sentence_id": "s-30", "note": "Convey means to communicate to the public or distribute" },
        { "sentence_id": "s-38", "note": "3.1 You may copy and Convey verbatim copies of Covered Source, in any medium, provided You retain all Notices" },
        { "sentence_id": "s-50", "note": "Section 4: You may Make Products, and/or Convey them" }
      ],
      "external_references": []
    },
    {
      "key": "private-use",
      "value": "permitted",
      "citations": [
        { "sentence_id": "s-32", "note": "2.1 governs use, copying, modification ... (broad grant encompasses private use)" },
        { "sentence_id": "s-36", "note": "2.4 This Licence is not intended to restrict fair use, fair dealing, or any other similar right" }
      ],
      "external_references": []
    },
    {
      "key": "patent-use",
      "value": "permitted",
      "citations": [
        { "sentence_id": "s-63", "note": "7.1 each Licensor hereby grants to You a perpetual, worldwide, non-exclusive, no-charge, royalty-free, irrevocable ... patent license to Make, have Made, use, offer to sell, sell, import, and otherwise transfer the Covered Source and Products" },
        { "sentence_id": "s-64", "note": "7.2 patent retaliation: rights terminate on patent litigation" }
      ],
      "external_references": []
    }
  ],
  "conditions": [
    {
      "key": "include-copyright",
      "value": "required",
      "citations": [
        { "sentence_id": "s-26", "note": "Notice includes copyright, acknowledgement and trademark notices" },
        { "sentence_id": "s-38", "note": "3.1 provided You retain all Notices" },
        { "sentence_id": "s-44", "note": "3.3(a) retain Notices as required in subsection 3.2" }
      ],
      "external_references": []
    },
    {
      "key": "document-changes",
      "value": "required",
      "citations": [
        { "sentence_id": "s-45", "note": "3.3(b) add a Notice to the modified Covered Source stating that You have modified it, with the date and brief description of how You have modified it" }
      ],
      "external_references": []
    },
    {
      "key": "disclose-source",
      "value": "required",
      "citations": [
        { "sentence_id": "s-39", "note": "3.2 You irrevocably undertake to make that modified Covered Source available from a Source Location should You Convey a Product" },
        { "sentence_id": "s-42", "note": "Including Covered Source in a larger work is modifying the Covered Source, and the larger work becomes modified Covered Source (strong reciprocal scope)" },
        { "sentence_id": "s-50", "note": "Section 4: You may Make Products, and/or Convey them, provided that You either provide each recipient with a copy of the Complete Source or ensure that each recipient is notified of the Source Location of the Complete Source" },
        { "sentence_id": "s-51", "note": "That Complete Source is Covered Source, and You must accordingly satisfy Your obligations set out in subsection 3.3" }
      ],
      "external_references": [],
      "commentary": "Strongly reciprocal: the entire Complete Source (the set of all Source necessary to Make the Product, except Available Components with adequate sourcing information) must be available under CERN-OHL-S. Unlike CERN-OHL-W, there is no External Material carve-out."
    },
    {
      "key": "network-use-disclose",
      "value": "silent",
      "citations": [],
      "external_references": [],
      "commentary": "Network/remote-use disclosure is not a natural concept for physical hardware products and is not addressed by CERN-OHL-S."
    },
    {
      "key": "same-license",
      "value": "required",
      "citations": [
        { "sentence_id": "s-42", "note": "Including Covered Source in a larger work is modifying the Covered Source, and the larger work becomes modified Covered Source (strong reciprocal scope at whole-design level)" },
        { "sentence_id": "s-47", "note": "3.3(d) license the modified Covered Source under the terms and conditions of this Licence" },
        { "sentence_id": "s-48", "note": "Such modified Covered Source must be licensed as a whole, but excluding Available Components contained in it, which remain licensed under their own applicable licences" }
      ],
      "external_references": [],
      "commentary": "Strong (whole-design) reciprocity: including Covered Source in a larger work makes the larger work itself modified Covered Source, so the entire design/Product must be licensed under CERN-OHL-S 2.0 (excluding only Available Components). Unlike CERN-OHL-W, there is no External-Material/documented-interface carve-out, and Products themselves must carry the reciprocal obligation."
    },
    {
      "key": "attribution",
      "value": "required",
      "citations": [
        { "sentence_id": "s-26", "note": "Notice includes copyright, acknowledgement and trademark notices and all notices that refer to this Licence" },
        { "sentence_id": "s-38", "note": "3.1 provided You retain all Notices" },
        { "sentence_id": "s-52", "note": "If specified in a Notice, the Product must visibly and securely display the Source Location on it or its packaging or documentation" }
      ],
      "external_references": []
    }
  ],
  "limitations": [
    {
      "key": "liability",
      "value": "forbidden",
      "citations": [
        { "sentence_id": "s-61", "note": "6.2 EXCLUSION AND LIMITATION OF LIABILITY -- The Licensor shall, to the maximum extent permitted by law, have no liability for direct, indirect, special, incidental, consequential, exemplary, punitive or other damages" }
      ],
      "external_references": []
    },
    {
      "key": "warranty",
      "value": "forbidden",
      "citations": [
        { "sentence_id": "s-57", "note": "6.1 DISCLAIMER OF WARRANTY -- The Covered Source and any Products are provided 'as is' and any express or implied warranties ... are disclaimed" },
        { "sentence_id": "s-60", "note": "This disclaimer of warranty is an essential part of this Licence" }
      ],
      "external_references": []
    },
    {
      "key": "trademark",
      "value": "silent",
      "citations": [
        { "sentence_id": "s-67", "note": "8.2 You shall not use any of the name ... image, or logo by which the Licensor or CERN is known, except where needed to comply with section 3" }
      ],
      "external_references": [],
      "commentary": "No affirmative trademark grant; §8.2 imposes a narrow endorsement/name-use restriction rather than a general denial of trademark rights."
    }
  ],
  "sources": [
    { "source": "CERN Open Hardware Licence Version 2 - Strongly Reciprocal text", "url": "licenses/cern-ohl-s-2.0/text.html", "role": "primary evidence" }
  ]
}
