{
  "permissions": [
    {
      "key": "commercial-use",
      "value": "permitted",
      "citations": [
        { "sentence_id": "s-1", "note": "Permission is hereby granted, free of charge ... to use, reproduce, display, distribute, execute, and transmit the Software, and to prepare derivative works" }
      ],
      "external_references": []
    },
    {
      "key": "modification",
      "value": "permitted",
      "citations": [
        { "sentence_id": "s-1", "note": "to prepare derivative works of the Software" }
      ],
      "external_references": []
    },
    {
      "key": "distribution",
      "value": "permitted",
      "citations": [
        { "sentence_id": "s-1", "note": "to use, reproduce, display, distribute, execute, and transmit the Software ... and to permit third-parties to whom the Software is furnished to do so" }
      ],
      "external_references": []
    },
    {
      "key": "private-use",
      "value": "permitted",
      "citations": [
        { "sentence_id": "s-1", "note": "Permission is hereby granted ... to use, reproduce, display, distribute, execute, and transmit the Software" }
      ],
      "external_references": []
    },
    {
      "key": "patent-use",
      "value": "silent",
      "citations": [],
      "external_references": []
    }
  ],
  "conditions": [
    {
      "key": "include-copyright",
      "value": "required",
      "citations": [
        { "sentence_id": "s-2", "note": "The copyright notices in the Software and this entire statement ... must be included in all copies of the Software, in whole or in part, and all derivative works" }
      ],
      "external_references": [],
      "commentary": "Notable carve-out: the include-copyright/include-license obligation does not apply when the distribution consists solely of machine-executable object code generated by a source language processor. So binary-only redistributions are exempt from the notice requirement, which is a clear difference from MIT."
    },
    {
      "key": "document-changes",
      "value": "silent",
      "citations": [],
      "external_references": []
    },
    {
      "key": "disclose-source",
      "value": "silent",
      "citations": [],
      "external_references": []
    },
    {
      "key": "network-use-disclose",
      "value": "silent",
      "citations": [],
      "external_references": []
    },
    {
      "key": "same-license",
      "value": "silent",
      "citations": [],
      "external_references": []
    },
    {
      "key": "attribution",
      "value": "required",
      "citations": [
        { "sentence_id": "s-2", "note": "The copyright notices in the Software and this entire statement ... must be included in all copies of the Software ... and all derivative works of the Software, unless such copies or derivative works are solely in the form of machine-executable object code" }
      ],
      "external_references": [],
      "commentary": "Attribution is required for source redistributions but waived for binary-only distributions per the object-code carve-out at the end of the condition."
    }
  ],
  "limitations": [
    {
      "key": "liability",
      "value": "forbidden",
      "citations": [
        { "sentence_id": "s-4", "note": "IN NO EVENT SHALL THE COPYRIGHT HOLDERS OR ANYONE DISTRIBUTING THE SOFTWARE BE LIABLE FOR ANY DAMAGES OR OTHER LIABILITY" }
      ],
      "external_references": []
    },
    {
      "key": "warranty",
      "value": "forbidden",
      "citations": [
        { "sentence_id": "s-3", "note": "THE SOFTWARE IS PROVIDED AS IS, WITHOUT WARRANTY OF ANY KIND, EXPRESS OR IMPLIED, INCLUDING BUT NOT LIMITED TO THE WARRANTIES OF MERCHANTABILITY, FITNESS FOR A PARTICULAR PURPOSE, TITLE AND NON-INFRINGEMENT" }
      ],
      "external_references": []
    },
    {
      "key": "trademark",
      "value": "silent",
      "citations": [],
      "external_references": []
    }
  ],
  "sources": [
    { "source": "Boost Software License 1.0 text", "url": "licenses/bsl-1.0/text.html", "role": "primary evidence" }
  ]
}
