{
  "permissions": [
    {
      "key": "commercial-use",
      "value": "grey",
      "citations": [
        { "sentence_id": "s-4", "note": "The Licensor grants the right to 'copy, modify, create derivative works, redistribute, and make non-production use of the Licensed Work'; production use is not granted by default." },
        { "sentence_id": "s-5", "note": "Licensor may make an 'Additional Use Grant' permitting limited production use (the carve-out is per-deployment and is set by the Licensor, not the license)." },
        { "sentence_id": "s-6", "note": "Effective on the Change Date (or the fourth anniversary of first publicly available distribution, whichever comes first) the rights granted by the specified Change License kick in and the non-production restriction terminates." },
        { "sentence_id": "s-7", "note": "If your use of the Licensed Work does not comply with the requirements, 'you must purchase a commercial license from the Licensor ... or you must refrain from using the Licensed Work.'" }
      ],
      "external_references": [
        {
          "source": "OSI blog: The Business Source License",
          "url": "https://opensource.org/blog/business-source-license",
          "retrieved_at": "2026-04-21T19:00:00Z",
          "summary": "OSI explains that BUSL permits only non-production use until the Change Date, at which point the license converts to the specified Change License (often GPLv2+). This is why BUSL is classified as source-available, not open source."
        }
      ],
      "commentary": "Commercial/production use is restricted during the Business Source period. Non-production use (development, test, internal evaluation) is freely permitted; production use requires either an Additional Use Grant set by the Licensor or a separately purchased commercial license. On the Change Date (no later than four years after first release) those restrictions lift and the Change License (typically GPLv2+ or a GPL-compatible license) applies instead."
    },
    {
      "key": "modification",
      "value": "permitted",
      "citations": [
        { "sentence_id": "s-4", "note": "Explicit grant to 'copy, modify, create derivative works, redistribute' the Licensed Work." }
      ],
      "external_references": [],
      "commentary": "Modification is permitted, but downstream use of the modified work remains bound by the same non-production restriction during the Business Source period (see s-8)."
    },
    {
      "key": "distribution",
      "value": "permitted",
      "citations": [
        { "sentence_id": "s-4", "note": "Explicit grant to 'redistribute' the Licensed Work." },
        { "sentence_id": "s-8", "note": "'All copies of the original and modified Licensed Work, and derivative works of the Licensed Work, are subject to this License.'" }
      ],
      "external_references": [],
      "commentary": "Redistribution is permitted but the same non-production restriction follows the work (s-8). Recipients can only use it non-production until the Change Date."
    },
    {
      "key": "private-use",
      "value": "permitted",
      "citations": [
        { "sentence_id": "s-4", "note": "Non-production use is explicitly granted; private development and evaluation fall inside this grant." }
      ],
      "external_references": []
    },
    {
      "key": "patent-use",
      "value": "silent",
      "citations": [],
      "external_references": [],
      "commentary": "BUSL 1.1 makes no mention of patents and grants no express patent license. After the Change Date the Change License (if GPLv3-compatible) may supply one."
    }
  ],
  "conditions": [
    {
      "key": "include-copyright",
      "value": "required",
      "citations": [
        { "sentence_id": "s-10", "note": "'You must conspicuously display this License on each original or modified copy of the Licensed Work.'" },
        { "sentence_id": "s-11", "note": "License terms travel with copies received from third parties." }
      ],
      "external_references": []
    },
    {
      "key": "document-changes",
      "value": "silent",
      "citations": [],
      "external_references": []
    },
    {
      "key": "disclose-source",
      "value": "silent",
      "citations": [],
      "external_references": [],
      "commentary": "BUSL is source-available by convention (the Licensor must publish the source to offer BUSL terms), but the license text imposes no source-disclosure obligation on licensees. After the Change Date, the Change License may impose one (e.g. GPL)."
    },
    {
      "key": "network-use-disclose",
      "value": "silent",
      "citations": [],
      "external_references": []
    },
    {
      "key": "same-license",
      "value": "grey",
      "citations": [
        { "sentence_id": "s-8", "note": "'All copies of the original and modified Licensed Work, and derivative works of the Licensed Work, are subject to this License.'" },
        { "sentence_id": "s-6", "note": "Effective on the Change Date the rights granted shift to the terms of the Change License." },
        { "sentence_id": "s-20", "note": "Covenant 1: the Change License must be GPL v2 or later, or a license compatible with GPL v2 or later." }
      ],
      "external_references": [],
      "commentary": "During the Business Source period BUSL functions as a strong same-license obligation (s-8): derivatives and redistributed copies stay under BUSL. On the Change Date the license automatically converts to the specified Change License (s-6), which the BUSL covenants require to be GPLv2-or-later-compatible (s-20). BUSL is therefore time-delayed copyleft rather than traditional same-license."
    },
    {
      "key": "attribution",
      "value": "required",
      "citations": [
        { "sentence_id": "s-10", "note": "The license must be conspicuously displayed on each original or modified copy." }
      ],
      "external_references": []
    }
  ],
  "limitations": [
    {
      "key": "liability",
      "value": "forbidden",
      "citations": [
        { "sentence_id": "s-14", "note": "'TO THE EXTENT PERMITTED BY APPLICABLE LAW, THE LICENSED WORK IS PROVIDED ON AN \"AS IS\" BASIS.'" },
        { "sentence_id": "s-15", "note": "'LICENSOR HEREBY DISCLAIMS ALL WARRANTIES AND CONDITIONS, EXPRESS OR IMPLIED ...'" }
      ],
      "external_references": [],
      "commentary": "BUSL uses a combined AS IS / warranty-disclaimer clause. Liability limitation flows from the AS IS basis."
    },
    {
      "key": "warranty",
      "value": "forbidden",
      "citations": [
        { "sentence_id": "s-15", "note": "'LICENSOR HEREBY DISCLAIMS ALL WARRANTIES AND CONDITIONS, EXPRESS OR IMPLIED, INCLUDING (WITHOUT LIMITATION) WARRANTIES OF MERCHANTABILITY, FITNESS FOR A PARTICULAR PURPOSE, NON-INFRINGEMENT, AND TITLE.'" }
      ],
      "external_references": []
    },
    {
      "key": "trademark",
      "value": "silent",
      "citations": [
        { "sentence_id": "s-13", "note": "'This License does not grant you any right in any trademark or logo of Licensor or its affiliates (provided that you may use a trademark or logo of Licensor as expressly required by this License).'" }
      ],
      "external_references": [],
      "commentary": "The license expressly disclaims a trademark grant. Classified as silent on trademark-use-as-a-right because no grant is given; it is not a usage restriction in the sense of a forbidden mark (compare Apache 2.0 §6 which is more explicit about no-endorsement)."
    }
  ],
  "sources": [
    { "source": "Business Source License 1.1 text", "url": "licenses/busl-1.1/text.html", "role": "primary evidence" },
    { "source": "OSI blog: The Business Source License", "url": "https://opensource.org/blog/business-source-license", "role": "OSI classification commentary" },
    { "source": "MariaDB BSL 1.1 canonical page", "url": "https://mariadb.com/bsl11/", "role": "canonical publisher" }
  ]
}
