{
  "permissions": [
    {
      "key": "commercial-use",
      "value": "permitted",
      "citations": [
        { "sentence_id": "s-31", "note": "You may copy and distribute the Document in any medium, either commercially or noncommercially" },
        { "sentence_id": "s-33", "note": "However, you may accept compensation in exchange for copies" }
      ],
      "external_references": []
    },
    {
      "key": "modification",
      "value": "permitted",
      "citations": [
        { "sentence_id": "s-49", "note": "You may copy and distribute a Modified Version of the Document under the conditions of sections 2 and 3 above" }
      ],
      "external_references": []
    },
    {
      "key": "distribution",
      "value": "permitted",
      "citations": [
        { "sentence_id": "s-31", "note": "You may copy and distribute the Document in any medium" },
        { "sentence_id": "s-14", "note": "This License applies to any manual or other work that contains a notice" }
      ],
      "external_references": [],
      "commentary": "Distribution has extensive requirements including Cover Texts, Invariant Sections, Transparent copies (§3), and History/authorship preservation (§4)."
    },
    {
      "key": "private-use",
      "value": "permitted",
      "citations": [
        { "sentence_id": "s-14", "note": "This License applies to any manual or other work that contains a notice placed by the copyright holder saying it can be distributed under the terms of this License" },
        { "sentence_id": "s-16", "note": "Any member of the public is a licensee, and is addressed as 'you'" }
      ],
      "external_references": []
    },
    {
      "key": "patent-use",
      "value": "silent",
      "citations": [],
      "external_references": []
    }
  ],
  "conditions": [
    {
      "key": "include-copyright",
      "value": "required",
      "citations": [
        { "sentence_id": "s-31", "note": "the copyright notices, and the license notice saying this License applies to the Document are reproduced in all copies" },
        { "sentence_id": "s-59", "note": "§4.D: Preserve all the copyright notices of the Document" },
        { "sentence_id": "s-61", "note": "§4.E: Add an appropriate copyright notice for your modifications adjacent to the other copyright notices" },
        { "sentence_id": "s-63", "note": "§4.F: Include a license notice giving the public permission to use the Modified Version under the terms of this License" },
        { "sentence_id": "s-67", "note": "§4.H: Include an unaltered copy of this License" }
      ],
      "external_references": []
    },
    {
      "key": "document-changes",
      "value": "required",
      "citations": [
        { "sentence_id": "s-52", "note": "§4.A: Use in the Title Page a title distinct from that of the Document, and from those of previous versions" },
        { "sentence_id": "s-55", "note": "§4.B: List on the Title Page, as authors, one or more persons or entities responsible for authorship of the modifications" },
        { "sentence_id": "s-69", "note": "§4.I: Preserve the section entitled History, and its title, and add to it an item stating at least the title, year, new authors, and publisher of the Modified Version" }
      ],
      "external_references": []
    },
    {
      "key": "disclose-source",
      "value": "required",
      "citations": [
        { "sentence_id": "s-44", "note": "§3: If you publish or distribute Opaque copies ... numbering more than 100, you must either include a machine-readable Transparent copy along with each Opaque copy, or state ... a publicly-accessible computer-network location containing a complete Transparent copy of the Document" }
      ],
      "external_references": [],
      "commentary": "The Transparent-copy requirement (§3) is the documentation analogue of source disclosure: editable machine-readable copies must be provided when distributing Opaque copies in quantity (more than 100)."
    },
    {
      "key": "network-use-disclose",
      "value": "silent",
      "citations": [],
      "external_references": []
    },
    {
      "key": "same-license",
      "value": "required",
      "citations": [
        { "sentence_id": "s-49", "note": "§4: you release the Modified Version under precisely this License, with the Modified Version filling the role of the Document" },
        { "sentence_id": "s-7", "note": "This License is a kind of copyleft, which means that derivative works of the document must themselves be free in the same sense" },
        { "sentence_id": "s-95", "note": "§5: You may combine the Document with other documents released under this License, under the terms defined in section 4 above for modified versions" }
      ],
      "external_references": [],
      "commentary": "Strong copyleft for documentation. 1.1 is the original GFDL: it has no §11 Relicensing path (added in 1.3) and no Warranty Disclaimer machinery (added in 1.2). Invariant Sections and Cover Texts must be preserved verbatim in all derivatives."
    },
    {
      "key": "attribution",
      "value": "required",
      "citations": [
        { "sentence_id": "s-55", "note": "§4.B: List on the Title Page, as authors, one or more persons or entities responsible for authorship of the modifications ... together with at least five of the principal authors of the Document" },
        { "sentence_id": "s-59", "note": "§4.D: Preserve all the copyright notices of the Document" },
        { "sentence_id": "s-69", "note": "§4.I: History section preserving title, year, authors, and publisher" }
      ],
      "external_references": []
    }
  ],
  "limitations": [
    {
      "key": "liability",
      "value": "silent",
      "citations": [],
      "external_references": [],
      "commentary": "GFDL 1.1 contains no liability disclaimer and no Warranty Disclaimer machinery at all: the words 'warranty', 'liability', and 'disclaimer' do not appear in the license text. The §1 Warranty Disclaimers definition and the §4.O 'Preserve any Warranty Disclaimers' requirement were added in GFDL 1.2 (November 2002). Licensors relying on 1.1 therefore have no license-supplied way to attach a liability disclaimer that rides with the Document, making real-world reliance on 1.1 unusual for anything beyond backfilled SPDX provenance."
    },
    {
      "key": "warranty",
      "value": "silent",
      "citations": [],
      "external_references": [],
      "commentary": "GFDL 1.1 contains no warranty disclaimer of its own and no 'Warranty Disclaimers' incorporation-by-reference clause (that machinery first appears in GFDL 1.2, §1). The license is simply silent on warranty, which under US copyright licensing practice would leave UCC-style implied warranties intact absent a separate author-supplied disclaimer."
    },
    {
      "key": "trademark",
      "value": "silent",
      "citations": [],
      "external_references": []
    }
  ],
  "sources": [
    { "source": "GNU Free Documentation License v1.1 text", "url": "licenses/gfdl-1.1-only/text.html", "role": "primary evidence" }
  ]
}
