{
  "permissions": [
    { "key": "commercial-use", "value": "permitted", "citations": [{ "sentence_id": "s-4", "note": "nonexclusive, royalty-free, world-wide license to reproduce, analyze, test, perform and/or display publicly, prepare derivative works, distribute, and otherwise use Python alone or in any derivative version" }], "external_references": [] },
    { "key": "modification",   "value": "permitted", "citations": [{ "sentence_id": "s-4", "note": "prepare derivative works" }], "external_references": [] },
    { "key": "distribution",   "value": "permitted", "citations": [{ "sentence_id": "s-4", "note": "distribute ... Python alone or in any derivative version" }], "external_references": [] },
    { "key": "private-use",    "value": "permitted", "citations": [{ "sentence_id": "s-4", "note": "world-wide license to ... otherwise use Python alone or in any derivative version" }], "external_references": [] },
    { "key": "patent-use",     "value": "silent",    "citations": [], "external_references": [] }
  ],
  "conditions": [
    { "key": "include-copyright",    "value": "required", "citations": [{ "sentence_id": "s-4", "note": "PSF's License Agreement and PSF's notice of copyright ... are retained in Python alone or in any derivative version prepared by Licensee" }], "external_references": [] },
    { "key": "document-changes",     "value": "required", "citations": [{ "sentence_id": "s-6", "note": "In the event Licensee prepares a derivative work ... Licensee hereby agrees to include in any such work a brief summary of the changes made to Python" }], "external_references": [] },
    { "key": "disclose-source",      "value": "silent",   "citations": [], "external_references": [] },
    { "key": "network-use-disclose", "value": "silent",   "citations": [], "external_references": [] },
    { "key": "same-license",         "value": "silent",   "citations": [], "external_references": [] },
    { "key": "attribution",          "value": "required", "citations": [{ "sentence_id": "s-4", "note": "PSF's License Agreement and PSF's notice of copyright ... are retained in Python alone or in any derivative version prepared by Licensee" }], "external_references": [] }
  ],
  "limitations": [
    { "key": "liability", "value": "forbidden", "citations": [{ "sentence_id": "s-12", "note": "PSF SHALL NOT BE LIABLE TO LICENSEE OR ANY OTHER USERS OF PYTHON FOR ANY INCIDENTAL, SPECIAL, OR CONSEQUENTIAL DAMAGES OR LOSS" }], "external_references": [] },
    { "key": "warranty",  "value": "forbidden", "citations": [
      { "sentence_id": "s-8", "note": "PSF is making Python available to Licensee on an 'AS IS' basis." },
      { "sentence_id": "s-9", "note": "PSF MAKES NO REPRESENTATIONS OR WARRANTIES, EXPRESS OR IMPLIED." },
      { "sentence_id": "s-10", "note": "DISCLAIMS ANY REPRESENTATION OR WARRANTY OF MERCHANTABILITY OR FITNESS FOR ANY PARTICULAR PURPOSE" }
    ], "external_references": [] },
    { "key": "trademark", "value": "silent",    "citations": [], "external_references": [] }
  ],
  "sources": [
    { "source": "PSF-2.0 text", "url": "licenses/psf-2.0/text.html", "role": "primary evidence" }
  ]
}
